{
  "$schema": "https://json-schema.org/draft/2020-12/schema",
  "$id": "https://brain-atlas.local/schema/asset-replay-evidence-v2.json",
  "title": "Brain Atlas manual DSI replay evidence v2",
  "type": "object",
  "additionalProperties": false,
  "required": [
    "schemaVersion",
    "asset",
    "classification",
    "environment",
    "invocation",
    "execution",
    "trackvis",
    "postprocess",
    "retention"
  ],
  "properties": {
    "schemaVersion": {
      "const": 2
    },
    "asset": {
      "enum": [
        "optic-radiation",
        "swm"
      ]
    },
    "classification": {
      "type": "object",
      "additionalProperties": false,
      "required": [
        "id",
        "name",
        "closeout"
      ],
      "properties": {
        "id": {
          "type": "integer",
          "minimum": 1,
          "maximum": 4
        },
        "name": {
          "enum": [
            "byte-exact",
            "decoded-exact-order-drift",
            "metric-only",
            "materially-different"
          ]
        },
        "closeout": {
          "enum": [
            "allowed-without-new-decision",
            "human-decision-required",
            "blocked"
          ]
        }
      }
    },
    "environment": {
      "type": "object",
      "additionalProperties": false,
      "required": [
        "platform",
        "machine",
        "python",
        "verifierGitHead",
        "execution"
      ],
      "properties": {
        "platform": {
          "type": "string",
          "minLength": 1
        },
        "machine": {
          "type": "string",
          "minLength": 1
        },
        "python": {
          "type": "string",
          "minLength": 1
        },
        "verifierGitHead": {
          "type": "string",
          "pattern": "^[0-9a-f]{40}$"
        },
        "execution": {
          "type": "object",
          "additionalProperties": false,
          "required": [
            "workingDirectory",
            "osVersion",
            "kernel",
            "machine",
            "bashVersion",
            "threadEnvironment"
          ],
          "properties": {
            "workingDirectory": {
              "type": "string",
              "minLength": 1
            },
            "osVersion": {
              "type": "string",
              "minLength": 1
            },
            "kernel": {
              "type": "string",
              "minLength": 1
            },
            "machine": {
              "type": "string",
              "minLength": 1
            },
            "bashVersion": {
              "type": "string",
              "minLength": 1
            },
            "threadEnvironment": {
              "type": "object",
              "additionalProperties": false,
              "required": [
                "OMP_NUM_THREADS",
                "OPENBLAS_NUM_THREADS",
                "VECLIB_MAXIMUM_THREADS",
                "MKL_NUM_THREADS",
                "NUMEXPR_NUM_THREADS"
              ],
              "properties": {
                "OMP_NUM_THREADS": {
                  "type": "string",
                  "minLength": 1
                },
                "OPENBLAS_NUM_THREADS": {
                  "type": "string",
                  "minLength": 1
                },
                "VECLIB_MAXIMUM_THREADS": {
                  "type": "string",
                  "minLength": 1
                },
                "MKL_NUM_THREADS": {
                  "type": "string",
                  "minLength": 1
                },
                "NUMEXPR_NUM_THREADS": {
                  "type": "string",
                  "minLength": 1
                }
              }
            }
          }
        }
      }
    },
    "invocation": {
      "type": "object",
      "additionalProperties": false,
      "required": [
        "wrapperVersion",
        "argv",
        "argvSha256",
        "executable",
        "explicitParameters",
        "scriptPath",
        "scriptBytes",
        "scriptSha256",
        "inputChecks"
      ],
      "properties": {
        "argv": {
          "type": "array",
          "minItems": 2,
          "items": {
            "type": "string"
          }
        },
        "argvSha256": {
          "$ref": "#/$defs/sha256"
        },
        "scriptPath": {
          "type": "string",
          "minLength": 1
        },
        "scriptBytes": {
          "type": "integer",
          "minimum": 1
        },
        "scriptSha256": {
          "$ref": "#/$defs/sha256"
        },
        "inputChecks": {
          "type": "array",
          "minItems": 3,
          "items": {
            "type": "object",
            "additionalProperties": false,
            "required": [
              "path",
              "bytes",
              "expectedSha256",
              "executionSha256"
            ],
            "properties": {
              "path": {
                "type": "string",
                "minLength": 1
              },
              "bytes": {
                "type": "integer",
                "minimum": 1
              },
              "expectedSha256": {
                "$ref": "#/$defs/sha256"
              },
              "executionSha256": {
                "$ref": "#/$defs/sha256"
              }
            }
          }
        },
        "wrapperVersion": {
          "const": 2
        },
        "executable": {
          "$ref": "#/$defs/fileIdentity"
        },
        "explicitParameters": {
          "type": "object",
          "additionalProperties": false,
          "required": [
            "randomSeed",
            "threadCount"
          ],
          "properties": {
            "randomSeed": {
              "$ref": "#/$defs/explicitParameter"
            },
            "threadCount": {
              "$ref": "#/$defs/explicitParameter"
            }
          }
        }
      }
    },
    "execution": {
      "type": "object",
      "additionalProperties": false,
      "required": [
        "receiptVersion",
        "humanReportedOutcome",
        "startedUtc",
        "endedUtc",
        "exitStatus",
        "unusedOrUnrecognizedOptions",
        "logPath",
        "logBytes",
        "logSha256",
        "outputMtimeNs",
        "logMtimeNs",
        "effectiveParameters",
        "warnings"
      ],
      "properties": {
        "humanReportedOutcome": {
          "enum": [
            "completed",
            "failed"
          ]
        },
        "logPath": {
          "type": "string",
          "minLength": 1
        },
        "logBytes": {
          "type": "integer",
          "minimum": 0
        },
        "logSha256": {
          "$ref": "#/$defs/sha256"
        },
        "outputMtimeNs": {
          "type": "integer",
          "minimum": 0
        },
        "logMtimeNs": {
          "type": "integer",
          "minimum": 0
        },
        "effectiveParameters": {
          "type": "object"
        },
        "warnings": {
          "type": "array",
          "items": {
            "type": "string"
          }
        },
        "receiptVersion": {
          "const": 2
        },
        "startedUtc": {
          "type": "string",
          "pattern": "^\\d{4}-\\d{2}-\\d{2}T\\d{2}:\\d{2}:\\d{2}Z$"
        },
        "endedUtc": {
          "type": "string",
          "pattern": "^\\d{4}-\\d{2}-\\d{2}T\\d{2}:\\d{2}:\\d{2}Z$"
        },
        "exitStatus": {
          "type": "integer",
          "minimum": 0,
          "maximum": 255
        },
        "unusedOrUnrecognizedOptions": {
          "const": false
        }
      }
    },
    "trackvis": {
      "type": "object",
      "additionalProperties": false,
      "required": [
        "path",
        "bytes",
        "sha256",
        "gzip",
        "streamlines",
        "decodedOrderSha256",
        "decodedMultisetSha256",
        "effectiveAffine",
        "reference"
      ],
      "properties": {
        "path": {
          "type": "string",
          "minLength": 1
        },
        "bytes": {
          "type": "integer",
          "minimum": 1
        },
        "sha256": {
          "$ref": "#/$defs/sha256"
        },
        "gzip": {
          "type": "boolean"
        },
        "streamlines": {
          "type": "integer",
          "minimum": 0
        },
        "decodedOrderSha256": {
          "$ref": "#/$defs/sha256"
        },
        "decodedMultisetSha256": {
          "$ref": "#/$defs/sha256"
        },
        "effectiveAffine": {
          "$ref": "#/$defs/matrix4"
        },
        "reference": {
          "type": "object",
          "additionalProperties": false,
          "required": [
            "acceptedByteSha256",
            "streamlines",
            "decodedOrderSha256",
            "decodedMultisetSha256"
          ],
          "properties": {
            "acceptedByteSha256": {
              "type": "array",
              "minItems": 1,
              "items": {
                "$ref": "#/$defs/sha256"
              }
            },
            "streamlines": {
              "type": "integer",
              "minimum": 0
            },
            "decodedOrderSha256": {
              "$ref": "#/$defs/sha256"
            },
            "decodedMultisetSha256": {
              "$ref": "#/$defs/sha256"
            }
          }
        }
      }
    },
    "postprocess": {
      "type": "object",
      "additionalProperties": false,
      "required": [
        "generatedPath",
        "bytes",
        "sha256",
        "details",
        "requiredShape",
        "requiredShapeSatisfied",
        "checkedOutputSha256",
        "checkedOutputByteExact"
      ],
      "properties": {
        "generatedPath": {
          "type": "string",
          "minLength": 1
        },
        "bytes": {
          "type": "integer",
          "minimum": 1
        },
        "sha256": {
          "$ref": "#/$defs/sha256"
        },
        "details": {
          "type": "object"
        },
        "requiredShape": {
          "type": "string",
          "minLength": 1
        },
        "requiredShapeSatisfied": {
          "type": "boolean"
        },
        "checkedOutputSha256": {
          "$ref": "#/$defs/sha256"
        },
        "checkedOutputByteExact": {
          "type": "boolean"
        }
      }
    },
    "retention": {
      "type": "object",
      "additionalProperties": false,
      "required": [
        "rawOutput",
        "log",
        "evidence",
        "replacementAuthorized"
      ],
      "properties": {
        "rawOutput": {
          "type": "string",
          "minLength": 1
        },
        "log": {
          "type": "string",
          "minLength": 1
        },
        "evidence": {
          "type": "string",
          "minLength": 1
        },
        "replacementAuthorized": {
          "const": false
        }
      }
    }
  },
  "$defs": {
    "sha256": {
      "type": "string",
      "pattern": "^[0-9a-f]{64}$"
    },
    "matrix4": {
      "type": "array",
      "minItems": 4,
      "maxItems": 4,
      "items": {
        "type": "array",
        "minItems": 4,
        "maxItems": 4,
        "items": {
          "type": "number"
        }
      }
    },
    "fileIdentity": {
      "type": "object",
      "additionalProperties": false,
      "required": [
        "path",
        "bytes",
        "sha256"
      ],
      "properties": {
        "path": {
          "type": "string",
          "minLength": 1
        },
        "bytes": {
          "type": "integer",
          "minimum": 1
        },
        "sha256": {
          "$ref": "#/$defs/sha256"
        }
      }
    },
    "explicitParameter": {
      "type": "object",
      "additionalProperties": false,
      "required": [
        "passed",
        "value"
      ],
      "properties": {
        "passed": {
          "type": "boolean"
        },
        "value": {
          "type": [
            "string",
            "null"
          ]
        }
      },
      "allOf": [
        {
          "if": {
            "properties": {
              "passed": {
                "const": true
              }
            }
          },
          "then": {
            "properties": {
              "value": {
                "type": "string"
              }
            }
          }
        },
        {
          "if": {
            "properties": {
              "passed": {
                "const": false
              }
            }
          },
          "then": {
            "properties": {
              "value": {
                "type": "null"
              }
            }
          }
        }
      ]
    }
  }
}
